{
  "schemaVersion": "1.0",
  "organizationName": "fabrikam",
  "workloadName": "catalog",
  "environment": "test",
  "tenantId": "",
  "subscriptionId": "",
  "deploymentRegion": "",
  "resourceGroup": "rg-fabrikam-catalog-sre-test",
  "agentName": "fabrikam-catalog-sre-test",
  "logAnalyticsWorkspace": "",
  "applicationInsightsInstance": "",
  "githubOrganization": "",
  "githubRepository": "",
  "azureDevOpsOrganization": "",
  "azureDevOpsProject": "",
  "incidentManagementPlatform": "None",
  "notificationChannel": "",
  "deploymentMode": "bicep",
  "agentOperatingStage": 0,
  "runMode": "Review",
  "automationsEnabled": false,
  "allowedAzureScopes": [],
  "allowedActions": [],
  "tags": {
    "environment": "test", "managedBy": "azure-sre-agent-starter",
    "workload": "catalog", "costCenter": "example-lab",
    "businessOwner": "example-business-team", "technicalOwner": "example-platform-team",
    "dataClassification": "internal"
  },
  "costCenter": "example-lab",
  "businessOwner": "example-business-team",
  "technicalOwner": "example-platform-team",
  "dataClassification": "internal",
  "retentionDays": null,
  "modelProvider": "",
  "modelName": ""
}