{
  "schemaVersion": "1.0",
  "organizationName": "fabrikam",
  "workloadName": "catalog",
  "environment": "prod",
  "tenantId": "",
  "subscriptionId": "",
  "deploymentRegion": "",
  "resourceGroup": "rg-fabrikam-catalog-sre-prod",
  "agentName": "fabrikam-catalog-sre-prod",
  "logAnalyticsWorkspace": "",
  "applicationInsightsInstance": "",
  "githubOrganization": "",
  "githubRepository": "",
  "azureDevOpsOrganization": "",
  "azureDevOpsProject": "",
  "incidentManagementPlatform": "None",
  "notificationChannel": "",
  "deploymentMode": "bicep",
  "agentOperatingStage": 0,
  "runMode": "Review",
  "automationsEnabled": false,
  "allowedAzureScopes": [],
  "allowedActions": [],
  "tags": {
    "environment": "prod", "managedBy": "azure-sre-agent-starter",
    "workload": "catalog", "costCenter": "example-production-review",
    "businessOwner": "example-business-team", "technicalOwner": "example-platform-team",
    "dataClassification": "internal"
  },
  "costCenter": "example-production-review",
  "businessOwner": "example-business-team",
  "technicalOwner": "example-platform-team",
  "dataClassification": "internal",
  "retentionDays": null,
  "modelProvider": "",
  "modelName": ""
}